{"$id":"https://github.com/itdojp/private-match-protocol/raw/main/schema/research-technology-authority.v0.1.schema.json","$schema":"https://json-schema.org/draft/2020-12/schema","additionalProperties":false,"properties":{"$schema":{"const":"https://json-schema.org/draft/2020-12/schema"},"artifact_status":{"const":"reviewed-snapshot"},"artifacts":{"items":{"additionalProperties":false,"properties":{"digest":{"pattern":"^sha256:[0-9a-f]{64}$","type":"string"},"path":{"maxLength":512,"minLength":1,"pattern":"^(?!/)(?![A-Za-z]:)(?!.*\\\\)(?!.*(?:^|/)\\.\\.?(?:/|$))[A-Za-z0-9._/-]+$","type":"string"},"role":{"enum":["adr","experiment-matrix","result-schema","technology-record"]}},"required":["path","digest","role"],"type":"object"},"maxItems":6,"minItems":6,"type":"array","uniqueItems":true},"authority_digest":{"pattern":"^sha256:[0-9a-f]{64}$","type":"string"},"commit":{"pattern":"^[0-9a-f]{40}$","type":"string"},"issue":{"additionalProperties":false,"properties":{"number":{"const":4},"state":{"const":"completed"},"title":{"const":"[Technology] Compare PSI, OPRF/VOPRF, MPC, and TEE candidates"}},"required":["number","state","title"],"type":"object"},"limitations":{"items":{"maxLength":2048,"minLength":1,"type":"string"},"maxItems":128,"minItems":1,"type":"array","uniqueItems":true},"local_result_status":{"const":"not-run"},"observed_at":{"format":"date","type":"string"},"production_selection_status":{"const":"not-selected"},"record_type":{"const":"research-technology-authority"},"repository":{"const":"itdojp/private-match-research"},"reviewed_at":{"format":"date","type":"string"},"schema_version":{"const":"0.1"},"selected_tracks":{"items":{"additionalProperties":false,"properties":{"execution_authorization":{"enum":["not-provided","human-required-not-provided"]},"initial_protocol":{"maxLength":128,"type":["string","null"]},"limitations":{"items":{"maxLength":2048,"minLength":1,"type":"string"},"maxItems":128,"minItems":1,"type":"array","uniqueItems":true},"local_result_status":{"const":"not-run"},"production_selection_status":{"const":"not-selected"},"secondary_source_repository":{"maxLength":512,"type":["string","null"]},"secondary_source_revision":{"maxLength":128,"type":["string","null"]},"source_repository":{"maxLength":2048,"minLength":1,"type":"string"},"source_revision":{"maxLength":2048,"minLength":1,"type":"string"},"standard":{"maxLength":128,"type":["string","null"]},"technology_family":{"enum":["psi","voprf-component","trusted-execution-environment"]},"track_id":{"enum":["secretflow-kkrt","rfc9497-circl-voprf","aws-nitro-enclave"]}},"required":["track_id","technology_family","source_repository","source_revision","secondary_source_repository","secondary_source_revision","initial_protocol","standard","local_result_status","production_selection_status","execution_authorization","limitations"],"type":"object"},"maxItems":3,"minItems":3,"type":"array"}},"required":["$schema","schema_version","record_type","artifact_status","repository","commit","issue","artifacts","selected_tracks","observed_at","reviewed_at","local_result_status","production_selection_status","limitations","authority_digest"],"title":"Reviewed Research technology selection snapshot","type":"object"}
