{"$schema":"https://json-schema.org/draft/2020-12/schema","artifact_status":"reviewed-snapshot","artifacts":[{"digest":"sha256:ccc3287ae979b95c62600cd8283b2389c05e44e076aa4836d4e034a01d4b2f9f","path":"decisions/ADR-0001-first-technology-bakeoff.md","role":"adr"},{"digest":"sha256:ff9a8b7bfb9353c0f38fad12aad120379c000859adeb07c913ba07452f7117ce","path":"benchmarks/experiment-matrix.yaml","role":"experiment-matrix"},{"digest":"sha256:b848e806353628c83d7e68a1c273e1da8b7541290a01952ae538a5696886603b","path":"benchmarks/result.schema.json","role":"result-schema"},{"digest":"sha256:f570bcd8cde457e32bdc78c8202779146da7a40961bd44269df9347703d8b053","path":"records/technologies/secretflow-psi.yaml","role":"technology-record"},{"digest":"sha256:b763711c3e648cd6c04f1d6e1c7936f0e2f5452a38b3606eb7e11fc83e8efe56","path":"records/technologies/rfc9497-circl-voprf.yaml","role":"technology-record"},{"digest":"sha256:435d21640a369a211e8323e55ab51b2499aa771dbc840678a922efc18eeaeaab","path":"records/technologies/aws-nitro-enclaves.yaml","role":"technology-record"}],"authority_digest":"sha256:641ec5766f05fd1ec3b9825682fa4e774d2bd3faecd8bfa314194ae203704b69","commit":"45607b57d61de5ff2d46a092dc24f6beb50dfe7c","issue":{"number":4,"state":"completed","title":"[Technology] Compare PSI, OPRF/VOPRF, MPC, and TEE candidates"},"limitations":["This is an offline reviewed snapshot and is not refreshed at runtime.","Experiment selection does not select a production architecture.","No local candidate result was available in the reviewed Research authority."],"local_result_status":"not-run","observed_at":"2026-07-20","production_selection_status":"not-selected","record_type":"research-technology-authority","repository":"itdojp/private-match-research","reviewed_at":"2026-08-08","schema_version":"0.1","selected_tracks":[{"execution_authorization":"not-provided","initial_protocol":"PROTOCOL_KKRT","limitations":["Semi-honest security only; malicious-party security and input completeness are not established.","Broad host privilege and host-network requirements remain experimental limitations."],"local_result_status":"not-run","production_selection_status":"not-selected","secondary_source_repository":null,"secondary_source_revision":null,"source_repository":"secretflow/psi","source_revision":"d7682707035d6b3e04cc09b8bfef629140641432","standard":null,"technology_family":"psi","track_id":"secretflow-kkrt"},{"execution_authorization":"not-provided","initial_protocol":null,"limitations":["VOPRF is a component, not a complete PSI or symmetric matching engine.","Low-entropy input protection requires separately reviewed application controls."],"local_result_status":"not-run","production_selection_status":"not-selected","secondary_source_repository":"https://www.rfc-editor.org/rfc/rfc9497","secondary_source_revision":"RFC 9497","source_repository":"cloudflare/circl","source_revision":"v1.6.4","standard":"RFC 9497","technology_family":"voprf-component","track_id":"rfc9497-circl-voprf"},{"execution_authorization":"human-required-not-provided","initial_protocol":null,"limitations":["Paid AWS execution requires separate human approval.","Side-channel resistance, input completeness, and endpoint correctness are not established."],"local_result_status":"not-run","production_selection_status":"not-selected","secondary_source_repository":"aws/aws-nitro-enclaves-nsm-api","secondary_source_revision":"v0.5.2","source_repository":"aws/aws-nitro-enclaves-cli","source_revision":"v1.4.5","standard":null,"technology_family":"trusted-execution-environment","track_id":"aws-nitro-enclave"}]}
